,title,score,id,subreddit,url,num_comments,body,created
0,Simple Questions Sunday!,8,cfycdb,gaming,https://www.reddit.com/r/gaming/comments/cfycdb/simple_questions_sunday/,36,"For those questions that don't feel worthy of a whole new post.

This thread is posted weekly on Sundays (adjustments made as needed).",1563739800.0
1,"Reminder: Submissions must be directly gaming-related, not just a ""forced"" connection via the title or a caption added to the content. Note that we do not allow non-gaming meme templates as submissions.",959,byynix,gaming,https://www.reddit.com/r/gaming/comments/byynix/reminder_submissions_must_be_directly/,0,,1560206454.0
2,all too familiar a sight here,33769,cg2eph,gaming,https://i.imgur.com/xz0f4U4.jpg,913,,1563763228.0
3,Breath of the Wild Weapon Durability,5825,cg2q0m,gaming,https://i.redd.it/0m6feybngpb31.jpg,210,,1563764863.0
4,Death Stranding irl,3550,cg2yyh,gaming,https://i.imgur.com/7vc74Jx.jpg,43,,1563766149.0
5,Think of the corporations!,6185,cg0p3t,gaming,https://i.redd.it/acbvpt3mlob31.jpg,257,,1563754427.0
6,"$2 yard sale find. Missing Volume 5, but now I can drive around feeling like I'm in Vice City.",6955,cg0dmb,gaming,https://i.redd.it/nrrqxusigob31.png,187,,1563752728.0
7,“There goes the family vacation”,2441,cg26c4,gaming,https://i.redd.it/9s3dfkq68pb31.jpg,47,,1563762018.0
8,"If it's good enough for Mario, then it's good enough for me",4204,cg0rkr,gaming,https://i.redd.it/h6p0rhhpmob31.jpg,33,,1563754793.0
9,2014 Squad,7895,cfyjqo,gaming,https://i.redd.it/l1y1u37tinb31.jpg,284,,1563741376.0
